{
  "pass1_record_id": "wipo-ipc-2026-01-pass1",
  "instrument_version": "0.5.0-draft",
  "normalization_codebook": {
    "path": "domain-universe/NORMALIZATION_CODEBOOK.md",
    "sha256": "bc0f2d62c8b6219911b759e8a69332021cb471167a9e3fdbc6a4b5b8918b69e4"
  },
  "universe_boundary": {
    "path": "domain-universe/boundaries/du-boundary-v0.1.json",
    "sha256": "d60ac188138cfc638b53ccfa05635e5d65372586d57553ff55fa7895040a6581"
  },
  "source_extraction": {
    "path": "domain-universe/extractions/wipo-ipc-2026-01-class.json",
    "sha256": "e8cf7903547eb245a2e4447b1221aa73df541c1da4a748e5127a232a87efe33c"
  },
  "procedure": "independent_entry_interpretation",
  "status": "complete",
  "clarification_sources": [],
  "interpretations": [
    {
      "source_entry_id": "ipc-A01",
      "source_entry_reference": "IPC 2026.01 / Section A HUMAN NECESSITIES / Class A01",
      "source_entry_descriptor": "AGRICULTURE; FORESTRY; ANIMAL HUSBANDRY; HUNTING; TRAPPING; FISHING",
      "frame_role_stripping": {
        "action": "none",
        "note": "No removable wrapper appears in the extracted title; its technological subject matter and functional distinctions are retained as substantive."
      },
      "normalized_substantive_locus": "AGRICULTURE; FORESTRY; ANIMAL HUSBANDRY; HUNTING; TRAPPING; FISHING",
      "minimal_gate_result": "passes",
      "evidence_basis": "title_and_parent_only",
      "clarification_source_ids": [],
      "rationale": "The official descriptor \"AGRICULTURE; FORESTRY; ANIMAL HUSBANDRY; HUNTING; TRAPPING; FISHING\" and recorded first-level parent context independently denote this technological subject area. No substantive activity, function, stage, purpose, or modifier is removed. Using the official descriptor as the narrowest neutral expression avoids broadening, and the locus can in principle host institutionalized or scalable recurrent sociotechnical improvement processes under du-boundary-v0.1. This permissive Pass 1 result is not final Domain eligibility.",
      "uncertainty": "Title and recorded parent context support this independent semantic and boundary interpretation. Pass 1 does not resolve equivalence, overlap, candidate identity, or final eligibility."
    },
    {
      "source_entry_id": "ipc-A21",
      "source_entry_reference": "IPC 2026.01 / Section A HUMAN NECESSITIES / Class A21",
      "source_entry_descriptor": "BAKING; EQUIPMENT FOR MAKING OR PROCESSING DOUGHS; DOUGHS FOR BAKING",
      "frame_role_stripping": {
        "action": "none",
        "note": "No removable wrapper appears in the extracted title; its technological subject matter and functional distinctions are retained as substantive."
      },
      "normalized_substantive_locus": "BAKING; EQUIPMENT FOR MAKING OR PROCESSING DOUGHS; DOUGHS FOR BAKING",
      "minimal_gate_result": "passes",
      "evidence_basis": "title_and_parent_only",
      "clarification_source_ids": [],
      "rationale": "The official descriptor \"BAKING; EQUIPMENT FOR MAKING OR PROCESSING DOUGHS; DOUGHS FOR BAKING\" and recorded first-level parent context independently denote this technological subject area. No substantive activity, function, stage, purpose, or modifier is removed. Using the official descriptor as the narrowest neutral expression avoids broadening, and the locus can in principle host institutionalized or scalable recurrent sociotechnical improvement processes under du-boundary-v0.1. This permissive Pass 1 result is not final Domain eligibility.",
      "uncertainty": "Title and recorded parent context support this independent semantic and boundary interpretation. Pass 1 does not resolve equivalence, overlap, candidate identity, or final eligibility."
    },
    {
      "source_entry_id": "ipc-A22",
      "source_entry_reference": "IPC 2026.01 / Section A HUMAN NECESSITIES / Class A22",
      "source_entry_descriptor": "BUTCHERING; MEAT TREATMENT; PROCESSING POULTRY OR FISH",
      "frame_role_stripping": {
        "action": "none",
        "note": "No removable wrapper appears in the extracted title; its technological subject matter and functional distinctions are retained as substantive."
      },
      "normalized_substantive_locus": "BUTCHERING; MEAT TREATMENT; PROCESSING POULTRY OR FISH",
      "minimal_gate_result": "passes",
      "evidence_basis": "title_and_parent_only",
      "clarification_source_ids": [],
      "rationale": "The official descriptor \"BUTCHERING; MEAT TREATMENT; PROCESSING POULTRY OR FISH\" and recorded first-level parent context independently denote this technological subject area. No substantive activity, function, stage, purpose, or modifier is removed. Using the official descriptor as the narrowest neutral expression avoids broadening, and the locus can in principle host institutionalized or scalable recurrent sociotechnical improvement processes under du-boundary-v0.1. This permissive Pass 1 result is not final Domain eligibility.",
      "uncertainty": "Title and recorded parent context support this independent semantic and boundary interpretation. Pass 1 does not resolve equivalence, overlap, candidate identity, or final eligibility."
    },
    {
      "source_entry_id": "ipc-A23",
      "source_entry_reference": "IPC 2026.01 / Section A HUMAN NECESSITIES / Class A23",
      "source_entry_descriptor": "FOODS, FOODSTUFFS OR NON-ALCOHOLIC BEVERAGES; PREPARATION, TREATMENT OR PRESERVATION THEREOF",
      "frame_role_stripping": {
        "action": "none",
        "note": "No removable wrapper appears in the extracted title; its technological subject matter and functional distinctions are retained as substantive."
      },
      "normalized_substantive_locus": "FOODS, FOODSTUFFS OR NON-ALCOHOLIC BEVERAGES; PREPARATION, TREATMENT OR PRESERVATION THEREOF",
      "minimal_gate_result": "passes",
      "evidence_basis": "title_and_parent_only",
      "clarification_source_ids": [],
      "rationale": "The official descriptor \"FOODS, FOODSTUFFS OR NON-ALCOHOLIC BEVERAGES; PREPARATION, TREATMENT OR PRESERVATION THEREOF\" and recorded first-level parent context independently denote this technological subject area. No substantive activity, function, stage, purpose, or modifier is removed. Using the official descriptor as the narrowest neutral expression avoids broadening, and the locus can in principle host institutionalized or scalable recurrent sociotechnical improvement processes under du-boundary-v0.1. This permissive Pass 1 result is not final Domain eligibility.",
      "uncertainty": "Title and recorded parent context support this independent semantic and boundary interpretation. Pass 1 does not resolve equivalence, overlap, candidate identity, or final eligibility."
    },
    {
      "source_entry_id": "ipc-A24",
      "source_entry_reference": "IPC 2026.01 / Section A HUMAN NECESSITIES / Class A24",
      "source_entry_descriptor": "TOBACCO; CIGARS; CIGARETTES; SIMULATED SMOKING DEVICES; SMOKERS' REQUISITES",
      "frame_role_stripping": {
        "action": "none",
        "note": "No removable wrapper appears in the extracted title; its technological subject matter and functional distinctions are retained as substantive."
      },
      "normalized_substantive_locus": "TOBACCO; CIGARS; CIGARETTES; SIMULATED SMOKING DEVICES; SMOKERS' REQUISITES",
      "minimal_gate_result": "passes",
      "evidence_basis": "title_and_parent_only",
      "clarification_source_ids": [],
      "rationale": "The official descriptor \"TOBACCO; CIGARS; CIGARETTES; SIMULATED SMOKING DEVICES; SMOKERS' REQUISITES\" and recorded first-level parent context independently denote this technological subject area. No substantive activity, function, stage, purpose, or modifier is removed. Using the official descriptor as the narrowest neutral expression avoids broadening, and the locus can in principle host institutionalized or scalable recurrent sociotechnical improvement processes under du-boundary-v0.1. This permissive Pass 1 result is not final Domain eligibility.",
      "uncertainty": "Title and recorded parent context support this independent semantic and boundary interpretation. Pass 1 does not resolve equivalence, overlap, candidate identity, or final eligibility."
    },
    {
      "source_entry_id": "ipc-A41",
      "source_entry_reference": "IPC 2026.01 / Section A HUMAN NECESSITIES / Class A41",
      "source_entry_descriptor": "WEARING APPAREL",
      "frame_role_stripping": {
        "action": "none",
        "note": "No removable wrapper appears in the extracted title; its technological subject matter and functional distinctions are retained as substantive."
      },
      "normalized_substantive_locus": "WEARING APPAREL",
      "minimal_gate_result": "passes",
      "evidence_basis": "title_and_parent_only",
      "clarification_source_ids": [],
      "rationale": "The official descriptor \"WEARING APPAREL\" and recorded first-level parent context independently denote this technological subject area. No substantive activity, function, stage, purpose, or modifier is removed. Using the official descriptor as the narrowest neutral expression avoids broadening, and the locus can in principle host institutionalized or scalable recurrent sociotechnical improvement processes under du-boundary-v0.1. This permissive Pass 1 result is not final Domain eligibility.",
      "uncertainty": "Title and recorded parent context support this independent semantic and boundary interpretation. Pass 1 does not resolve equivalence, overlap, candidate identity, or final eligibility."
    },
    {
      "source_entry_id": "ipc-A42",
      "source_entry_reference": "IPC 2026.01 / Section A HUMAN NECESSITIES / Class A42",
      "source_entry_descriptor": "HEADWEAR",
      "frame_role_stripping": {
        "action": "none",
        "note": "No removable wrapper appears in the extracted title; its technological subject matter and functional distinctions are retained as substantive."
      },